{
  "study_id": "CIS-EX-008-SYNTHETIC-FIXTURE",
  "schema_version": "0.3.0",
  "study_version": "0.1.0",
  "theory_version": "1.0.0",
  "protocol_ref": { "id": "CIS-EX-008-PROTOCOL", "version": "0.1.0" },
  "contract_refs": {
    "interaction": { "id": "CIS-EX-008-INTERACTION", "version": "0.2.0" },
    "projection": { "id": "CIS-EX-008-PROJECTION-SIGNALED", "version": "0.2.0" },
    "opportunity": { "id": "CIS-EX-008-OPPORTUNITY", "version": "0.2.0" },
    "behavioral_evidence": { "id": "CIS-EX-008-BEHAVIORAL-EVIDENCE", "version": "0.2.0" },
    "measurement": { "id": "CIS-EX-008-MEASUREMENT-DISCOVERY", "version": "0.2.0" },
    "similarity": null,
    "transfer": null,
    "strategy": null,
    "prediction": null,
    "comparison": null
  },
  "scope": {
    "population": "synthetic participant fixture; no human observation",
    "task": "bounded target-operation discovery task",
    "projection": "CIS-EX-008 signaled condition fixture",
    "context": "schema and lineage validation only"
  },
  "construct_refs": [
    { "label": "Interaction episode", "identifier_status": "unratified", "canonical_id": null },
    { "label": "Opportunity profile", "identifier_status": "unratified", "canonical_id": null }
  ],
  "participants": [
    {
      "participant_id": "CIS-EX-008-P-SYNTHETIC",
      "participant_kind": "person",
      "roles": ["study participant"],
      "capabilities": ["invoke target operation"],
      "authority": ["target operation", "recovery operation"],
      "pseudonymous": true,
      "consent_ref": "CIS-EX-008-CONSENT-SYNTHETIC-NOT-A-HUMAN-RECORD",
      "local_state_schema_ref": null
    },
    {
      "participant_id": "CIS-EX-008-TARGET-SYSTEM",
      "participant_kind": "computational_process",
      "roles": ["target system"],
      "capabilities": ["apply frozen transition semantics", "emit feedback"],
      "authority": ["commit valid target transitions"],
      "pseudonymous": false,
      "consent_ref": null,
      "local_state_schema_ref": "CIS-EX-008-STATE-SCHEMA"
    }
  ],
  "environments": [
    {
      "environment_id": "CIS-EX-008-ENV-SYNTHETIC",
      "version": "0.1.0",
      "boundary": "synthetic host, target state, projection, event recorder, and monotonic fixture clock",
      "state_schema_ref": "CIS-EX-008-STATE-SCHEMA",
      "authority": ["CIS-EX-008 proposed protocol"],
      "sensitive_context": false,
      "provenance": {
        "source_id": "CIS-EX-008-SYNTHETIC-GENERATOR",
        "method": "hand-authored deterministic validation fixture",
        "recorded_at": "2000-01-01T00:00:00Z",
        "software_version": "0.1.0",
        "instrument_version": null
      }
    }
  ],
  "interaction_episodes": [
    {
      "episode_id": "CIS-EX-008-EP-SYNTHETIC-001",
      "interaction_contract_ref": { "id": "CIS-EX-008-INTERACTION", "version": "0.2.0" },
      "participant_refs": ["CIS-EX-008-P-SYNTHETIC", "CIS-EX-008-TARGET-SYSTEM"],
      "boundary": "projection ready through explicit completion",
      "timescale": "synthetic monotonic episode",
      "start_time": "2000-01-01T00:00:00Z",
      "end_time": "2000-01-01T00:00:03Z",
      "initial_state_ref": "CIS-EX-008-STATE-000",
      "final_state_ref": "CIS-EX-008-STATE-001",
      "interaction_status": "candidate",
      "coupling_evidence_refs": ["CIS-EX-008-EVENT-SELECT", "CIS-EX-008-EVENT-FEEDBACK"],
      "reciprocal_constraint_evidence_refs": ["CIS-EX-008-EVENT-COMPLETE"],
      "completion_status": "synthetic criterion satisfied"
    }
  ],
  "states": [
    {
      "state_id": "CIS-EX-008-STATE-000",
      "payload_schema_ref": "CIS-EX-008-STATE-SCHEMA",
      "payload": { "target_complete": false },
      "provenance": {
        "source_id": "CIS-EX-008-TARGET-SYSTEM",
        "method": "synthetic initial state",
        "recorded_at": "2000-01-01T00:00:00Z",
        "software_version": "0.1.0",
        "instrument_version": null
      }
    },
    {
      "state_id": "CIS-EX-008-STATE-001",
      "payload_schema_ref": "CIS-EX-008-STATE-SCHEMA",
      "payload": { "target_complete": true },
      "provenance": {
        "source_id": "CIS-EX-008-TARGET-SYSTEM",
        "method": "synthetic committed transition",
        "recorded_at": "2000-01-01T00:00:02Z",
        "software_version": "0.1.0",
        "instrument_version": null
      }
    }
  ],
  "records": [
    {
      "record_id": "CIS-EX-008-REC-READY",
      "study_id": "CIS-EX-008-SYNTHETIC-FIXTURE",
      "episode_id": "CIS-EX-008-EP-SYNTHETIC-001",
      "participant_ref": null,
      "timestamp": "2000-01-01T00:00:00Z",
      "record_type": "projection.ready",
      "source": "CIS-EX-008-INSTRUMENT-EVENT-LOG",
      "payload_schema_ref": "CIS-EX-008-EVENT-PAYLOAD-SCHEMA",
      "payload": { "projection_ref": "CIS-EX-008-PROJECTION-SIGNALED" },
      "missingness": "not_missing",
      "quality_flags": [],
      "provenance": {
        "source_id": "CIS-EX-008-INSTRUMENT-EVENT-LOG",
        "method": "synthetic fixture event",
        "recorded_at": "2000-01-01T00:00:00Z",
        "software_version": "0.1.0",
        "instrument_version": "0.1.0"
      }
    },
    {
      "record_id": "CIS-EX-008-REC-BELIEF",
      "study_id": "CIS-EX-008-SYNTHETIC-FIXTURE",
      "episode_id": "CIS-EX-008-EP-SYNTHETIC-001",
      "participant_ref": "CIS-EX-008-P-SYNTHETIC",
      "timestamp": "2000-01-01T00:00:01Z",
      "record_type": "belief.report",
      "source": "CIS-EX-008-BELIEF-INSTRUMENT",
      "payload_schema_ref": "CIS-EX-008-BELIEF-PAYLOAD-SCHEMA",
      "payload": { "response": "yes" },
      "missingness": "not_missing",
      "quality_flags": [],
      "provenance": {
        "source_id": "CIS-EX-008-BELIEF-INSTRUMENT",
        "method": "synthetic fixture response",
        "recorded_at": "2000-01-01T00:00:01Z",
        "software_version": null,
        "instrument_version": "0.1.0"
      }
    },
    {
      "record_id": "CIS-EX-008-REC-SELECT",
      "study_id": "CIS-EX-008-SYNTHETIC-FIXTURE",
      "episode_id": "CIS-EX-008-EP-SYNTHETIC-001",
      "participant_ref": "CIS-EX-008-P-SYNTHETIC",
      "timestamp": "2000-01-01T00:00:02Z",
      "record_type": "action.select",
      "source": "CIS-EX-008-INSTRUMENT-EVENT-LOG",
      "payload_schema_ref": "CIS-EX-008-EVENT-PAYLOAD-SCHEMA",
      "payload": { "action_ref": "CIS-EX-008-ACTION-TARGET", "prompted": false },
      "missingness": "not_missing",
      "quality_flags": [],
      "provenance": {
        "source_id": "CIS-EX-008-INSTRUMENT-EVENT-LOG",
        "method": "synthetic fixture event",
        "recorded_at": "2000-01-01T00:00:02Z",
        "software_version": "0.1.0",
        "instrument_version": "0.1.0"
      }
    },
    {
      "record_id": "CIS-EX-008-REC-FEEDBACK",
      "study_id": "CIS-EX-008-SYNTHETIC-FIXTURE",
      "episode_id": "CIS-EX-008-EP-SYNTHETIC-001",
      "participant_ref": null,
      "timestamp": "2000-01-01T00:00:02.010Z",
      "record_type": "feedback.present",
      "source": "CIS-EX-008-INSTRUMENT-EVENT-LOG",
      "payload_schema_ref": "CIS-EX-008-EVENT-PAYLOAD-SCHEMA",
      "payload": { "result": "transition committed", "state_ref": "CIS-EX-008-STATE-001" },
      "missingness": "not_missing",
      "quality_flags": [],
      "provenance": {
        "source_id": "CIS-EX-008-INSTRUMENT-EVENT-LOG",
        "method": "synthetic fixture event",
        "recorded_at": "2000-01-01T00:00:02.010Z",
        "software_version": "0.1.0",
        "instrument_version": "0.1.0"
      }
    },
    {
      "record_id": "CIS-EX-008-REC-COMPLETE",
      "study_id": "CIS-EX-008-SYNTHETIC-FIXTURE",
      "episode_id": "CIS-EX-008-EP-SYNTHETIC-001",
      "participant_ref": "CIS-EX-008-P-SYNTHETIC",
      "timestamp": "2000-01-01T00:00:03Z",
      "record_type": "task.complete",
      "source": "CIS-EX-008-INSTRUMENT-EVENT-LOG",
      "payload_schema_ref": "CIS-EX-008-EVENT-PAYLOAD-SCHEMA",
      "payload": { "criterion": true },
      "missingness": "not_missing",
      "quality_flags": [],
      "provenance": {
        "source_id": "CIS-EX-008-INSTRUMENT-EVENT-LOG",
        "method": "synthetic fixture event",
        "recorded_at": "2000-01-01T00:00:03Z",
        "software_version": "0.1.0",
        "instrument_version": "0.1.0"
      }
    }
  ],
  "coded_events": [
    {
      "event_id": "CIS-EX-008-EVENT-READY",
      "episode_id": "CIS-EX-008-EP-SYNTHETIC-001",
      "record_refs": ["CIS-EX-008-REC-READY"],
      "event_type": "projection.ready",
      "participant_refs": ["CIS-EX-008-TARGET-SYSTEM"],
      "coding_level": "verified_observation",
      "coding_rules_ref": { "id": "CIS-EX-008-CODING-RULES", "version": "0.1.0" },
      "coder_refs": ["CIS-EX-008-DETERMINISTIC-CODER"],
      "coding_status": "provisional",
      "uncertainty_ref": "CIS-EX-008-UNCERTAINTY-SYNTHETIC",
      "provenance": { "source_id": "CIS-EX-008-REC-READY", "method": "synthetic deterministic coding", "recorded_at": "2000-01-01T00:00:00Z", "software_version": "0.1.0", "instrument_version": null }
    },
    {
      "event_id": "CIS-EX-008-EVENT-BELIEF",
      "episode_id": "CIS-EX-008-EP-SYNTHETIC-001",
      "record_refs": ["CIS-EX-008-REC-BELIEF"],
      "event_type": "belief.report",
      "participant_refs": ["CIS-EX-008-P-SYNTHETIC"],
      "coding_level": "verified_observation",
      "coding_rules_ref": { "id": "CIS-EX-008-CODING-RULES", "version": "0.1.0" },
      "coder_refs": ["CIS-EX-008-DETERMINISTIC-CODER"],
      "coding_status": "provisional",
      "uncertainty_ref": "CIS-EX-008-UNCERTAINTY-SYNTHETIC",
      "provenance": { "source_id": "CIS-EX-008-REC-BELIEF", "method": "synthetic deterministic coding", "recorded_at": "2000-01-01T00:00:01Z", "software_version": "0.1.0", "instrument_version": null }
    },
    {
      "event_id": "CIS-EX-008-EVENT-SELECT",
      "episode_id": "CIS-EX-008-EP-SYNTHETIC-001",
      "record_refs": ["CIS-EX-008-REC-SELECT"],
      "event_type": "action.select",
      "participant_refs": ["CIS-EX-008-P-SYNTHETIC"],